{"ts": "2026-09-13T00:58:46Z", "idea": "baseline", "iteration": 0, "hypothesis": "establish starting point before any tuning", "change": "none -- this is the state after the overnight run stopped (alias-phrase bug fixed, AND/OR reverted)", "decision": "BASELINE", "notes": "", "dev_hit24_before": null, "dev_hit24_after": 3, "dev_recall120_before": null, "dev_recall120_after": 0.2353, "holdout_hit24_before": null, "holdout_hit24_after": 0, "holdout_recall120_before": null, "holdout_recall120_after": 0.2}
{"ts": "2026-09-13T01:08:01Z", "idea": "1_captionless_detector", "iteration": 1, "hypothesis": "Original uncaptioned-block rule (>=2 years + >=2 numbers anywhere in a 12-line window) fires on ordinary prose, producing 1.1M of 1.2M cards; tightening to a real header-row shape (>=3 years on ONE line, not sentence-shaped, plus a data row within 6 lines) should cut false positives and let real tables rank higher.", "change": "extract.py: replaced the loose any-12-line-window rule with _looks_like_a_header_row + _detect_uncaptioned_tables (header-row shape required). Cards dropped 1,201,574 -> 88,041 (uncaptioned cards 1,111,638 -> 65).", "decision": "REVERTED", "notes": "Dev got WORSE (3/17->2/17, recall120 0.2353->0.1765); holdout mixed (hit24 0->1, recall120 0.2->0.1). Dev did not improve, so reverted per the rule. Likely cause: the loose detector was also the ONLY thing catching some genuinely real tables that do not fit the tightened template (2-year-column tables, wrapped headers, data rows further than 6 lines away) -- cutting precision cost some recall on exactly the real tables this was meant to help surface.", "dev_hit24_before": 3, "dev_hit24_after": 2, "dev_recall120_before": 0.2353, "dev_recall120_after": 0.1765, "holdout_hit24_before": 0, "holdout_hit24_after": 1, "holdout_recall120_before": 0.2, "holdout_recall120_after": 0.1}
{"ts": "2026-09-13T01:37:47Z", "idea": "1_captionless_detector", "iteration": 2, "hypothesis": "Relax iteration-1 thresholds (2 years not 3 per header line, lookahead 10 not 6) in case 3-years-per-line was too strict and cut real tables.", "change": "extract.py: YEAR threshold 3->2, lookahead 6->10.", "decision": "REVERTED", "notes": "Made everything worse in both directions: cards EXPLODED to 2,785,259 (more than the original 1.2M this was meant to shrink) because a short i..j cover window lets many near-miss lines each independently qualify, and dev/holdout both went to 0. Clear wrong direction; reverting.", "dev_hit24_before": 3, "dev_hit24_after": 0, "dev_recall120_before": 0.2353, "dev_recall120_after": 0.0, "holdout_hit24_before": 0, "holdout_hit24_after": 0, "holdout_recall120_before": 0.2, "holdout_recall120_after": 0.0}
{"ts": "2026-09-13T11:51:02Z", "idea": "1_captionless_detector", "iteration": 3, "hypothesis": "Require the literal corpus-template header line (\"Indicator <year> <year>...\") instead of inferring table-shape from year/number counts -- maximally conservative, near-zero false positives (measured 2.3% of sampled pages carry such a line).", "change": "extract.py: _looks_like_a_header_row requires a line matching ^\\s*Indicator\b plus >=2 years on it; lookahead back to 6.", "decision": "REVERTED", "notes": "Same shape of result as iteration 1 (2/17 dev, 1/30 holdout) since the resulting card population is nearly identical (87,997 vs 88,041 cards) -- dev still WORSE than baseline (3/17). Three iterations in a row have now failed to improve dev; per the stated stopping rule, abandoning idea 1 and moving to idea 2 (multi-query). Reverting extract.py to the original loose captionless-block rule before starting idea 2, so idea 2 is measured against the known baseline catalogue, not a regressed one.", "dev_hit24_before": 3, "dev_hit24_after": 2, "dev_recall120_before": 0.2353, "dev_recall120_after": 0.1765, "holdout_hit24_before": 0, "holdout_hit24_after": 1, "holdout_recall120_before": 0.2, "holdout_recall120_after": 0.1}
{"ts": "2026-09-13T12:05:19Z", "idea": "baseline", "iteration": 1, "hypothesis": "Re-verify the original loose-detector baseline reproduces after reverting idea 1.", "change": "extract.py reverted to the original 12-line-window rule; cards regenerated from stored page text via the fast regen tool (not a full cold rebuild).", "decision": "NOTE_ONLY", "notes": "Card count came back to 1,199,614 vs the original cold-build 1,201,574 (-1,960, ~0.16%) and the recall numbers shifted more than that tiny count difference would suggest (dev hit24 3/17->2/17, holdout recall120 0.2->0.1) -- some borderline candidates sit within a hair of each other in BM25 score (observed deltas as small as 0.00002 between adjacent ranks), so a small, likely-nondeterministic difference in exactly which stray uncaptioned cards got generated is enough to flip which document lands in top-24 for 1-2 questions. Treating +-1 on either hit24 count as within this measurement noise floor from here on; only a clearer, repeated movement is treated as real signal. This regenerated state (1,199,614 cards, dev 2/17, holdout 0/30) is the working baseline for subsequent idea comparisons, not the original cold-build numbers.", "dev_hit24_before": 3, "dev_hit24_after": 2, "dev_recall120_before": 0.2353, "dev_recall120_after": 0.1176, "holdout_hit24_before": 0, "holdout_hit24_after": 0, "holdout_recall120_before": 0.2, "holdout_recall120_after": 0.1}
{"ts": "2026-09-13T13:04:17Z", "idea": "2_multiquery", "iteration": 1, "hypothesis": "Generate deterministic query rewordings (full question, tail phrase, per-clause split) and fuse all of them (summed across variants and channels) instead of one bag-of-words query.", "change": "retrieve.py: generate_query_variants() + USE_MULTIQUERY flag; discover() runs run_channels() per variant and merges all into one fuse() call.", "decision": "REVERTED", "notes": "No change on dev (2/17 both), holdout recall120 slightly worse (0.1->0.0667). Isolated clause queries alone did not surface the right document either (traced mb_04: the isolated federal-PSDP clause query does not find the PSDP Federal table in its own top 30).", "dev_hit24_before": 2, "dev_hit24_after": 2, "dev_recall120_before": 0.1176, "dev_recall120_after": 0.1176, "holdout_hit24_before": 0, "holdout_hit24_after": 0, "holdout_recall120_before": 0.1, "holdout_recall120_after": 0.0667}
{"ts": "2026-09-13T13:04:17Z", "idea": "2_multiquery", "iteration": 2, "hypothesis": "Pair each later clause with clause 0 (the shared entity/period) instead of querying isolated clauses alone -- isolated generic clauses like \"federal development allocation\" cannot discriminate on their own.", "change": "retrieve.py: clause0+N pairing in generate_query_variants(), still summed across variants.", "decision": "REVERTED", "notes": "Still no movement on dev (2/17), holdout recall120 dropped further (0.0667->0.0333). Traced mb_04: the correct KP White Paper document ranked #6 when its one matching clause0+1 variant was queried ALONE, but fell OUT of the top 24 once summed with 4 other variants that also repeat the shared \"khyber pakhtunkhwa\" terms -- summing rewards repeated generic overlap, not specific relevance.", "dev_hit24_before": 2, "dev_hit24_after": 2, "dev_recall120_before": 0.1176, "dev_recall120_after": 0.1176, "holdout_hit24_before": 0, "holdout_hit24_after": 0, "holdout_recall120_before": 0.0667, "holdout_recall120_after": 0.0333}
{"ts": "2026-09-13T13:04:17Z", "idea": "2_multiquery", "iteration": 3, "hypothesis": "Fix the summing-inflation problem: fuse each variant SEPARATELY (own top-24) then take the BEST score per candidate across variants (max, not sum), so repeated shared terms across variants stop compounding.", "change": "discover(): per-variant fuse() then max-by-key merge, reserved_families=0 per variant.", "decision": "REVERTED", "notes": "STILL no movement (dev 2/17, holdout 0/30, recall120 0.0667 both before/after -- identical). Traced further: even the DEDICATED clause0+3 query for the KP ADP concept surfaces the right DOCUMENT only at rank 24/100, and via the wrong PAGE (a title-page paragraph hit, page 3, not page 68 where the actual table is) -- the compact table CARD for that exact table does not outrank a generic page hit on the specific terms tried. Three iterations in a row have not moved either number; per the stated stopping rule, abandoning idea 2 and moving to idea 3 (alias bridge widening). USE_MULTIQUERY left available (default False) for a future session; the underlying per-candidate card-vs-page ranking issue found here is a better lead than more query rewording.", "dev_hit24_before": 2, "dev_hit24_after": 2, "dev_recall120_before": 0.1176, "dev_recall120_after": 0.1176, "holdout_hit24_before": 0, "holdout_hit24_after": 0, "holdout_recall120_before": 0.0333, "holdout_recall120_after": 0.0667}
{"ts": "2026-09-13T13:31:21Z", "idea": "6_candidate_depth_and_stopwords", "iteration": 1, "hypothesis": "Traced tr_04 directly: its gold document scores well but never gets FETCHED because run_channels() only pulls each channel's top 100 raw hits before fusion, and trajectory-question framing words (\"look over the last decade or so\") add generic noise terms that push the real candidate below even a wider cutoff. Fix both: raise limit_per_channel 100->500, and add trajectory-framing words to STOPWORDS.", "change": "retrieve.py: run_channels() default limit_per_channel 100->500; STOPWORDS += {look,looks,looked,over,so,since,start,period,gone,happened,roughly,big,give,trajectory}.", "decision": "KEPT", "notes": "Confirmed on tr_04 directly first (absent in top-120 -> rank 87), then measured on the full sets: dev recall120 0.1176->0.1765 (hit24 unchanged 2/17), holdout hit24 0->2/30 AND recall120 0.0667->0.1667. Both dev and holdout moved the same direction on multiple metrics, nothing regressed -- kept.", "dev_hit24_before": 2, "dev_hit24_after": 2, "dev_recall120_before": 0.1176, "dev_recall120_after": 0.1765, "holdout_hit24_before": 0, "holdout_hit24_after": 2, "holdout_recall120_before": 0.1, "holdout_recall120_after": 0.1667}
{"ts": "2026-09-13T13:45:50Z", "idea": "6_candidate_depth_and_stopwords", "iteration": 2, "hypothesis": "Extend the stopword list further for other trajectory phrasings (across/years/much/up/down) and cd_04/rc_05-style words (current/series/lying).", "change": "retrieve.py: STOPWORDS += {across,years,much,up,down,current,series,lying}.", "decision": "REVERTED", "notes": "Dev unchanged (2/17, 0.1765); holdout got WORSE (hit24 2->1, though recall120 held at 0.1667). Reverting this specific extension, keeping iteration 1's stopwords.", "dev_hit24_before": 2, "dev_hit24_after": 2, "dev_recall120_before": 0.1765, "dev_recall120_after": 0.1765, "holdout_hit24_before": 2, "holdout_hit24_after": 1, "holdout_recall120_before": 0.1667, "holdout_recall120_after": 0.1667}
{"ts": "2026-09-13T13:51:43Z", "idea": "6_candidate_depth_and_stopwords", "iteration": 3, "hypothesis": "Push limit_per_channel further, 500->1000, in case more depth surfaces more borderline candidates.", "change": "retrieve.py: run_channels() default limit_per_channel 500->1000.", "decision": "REVERTED", "notes": "Identical numbers to iteration 1 in every metric -- no further candidates were gained by going deeper than 500 at this max_leads=120 cutoff, so the extra query cost is not justified. Reverting to 500.", "dev_hit24_before": 2, "dev_hit24_after": 2, "dev_recall120_before": 0.1765, "dev_recall120_after": 0.1765, "holdout_hit24_before": 2, "holdout_hit24_after": 2, "holdout_recall120_before": 0.1667, "holdout_recall120_after": 0.1667}
{"ts": "2026-09-13T13:58:27Z", "idea": "6_candidate_depth_and_stopwords", "iteration": 4, "hypothesis": "Reserve more family-diversity slots (8->16) and allow 3 pages/doc instead of 2, in case document diversity was still the bottleneck for multi-branch/trajectory questions.", "change": "discover(): fuse(..., reserved_families=16, max_pages_per_doc=3) for the single-query path.", "decision": "REVERTED", "notes": "No change whatsoever vs iteration 1 on any metric. Three iterations in a row (2,3,4) have now failed to move past iteration 1's gain; stopping this idea here per the stated rule and moving on. Reverting to plain fuse(channels, max_leads=max_leads) defaults.", "dev_hit24_before": 2, "dev_hit24_after": 2, "dev_recall120_before": 0.1765, "dev_recall120_after": 0.1765, "holdout_hit24_before": 2, "holdout_hit24_after": 2, "holdout_recall120_before": 0.1667, "holdout_recall120_after": 0.1667}
{"ts": "2026-09-13T14:30:33Z", "idea": "7_row_label_extraction_bug", "iteration": 1, "hypothesis": "While debugging idea 5 (family walk), inspected cards.row_labels directly and found it was frequently capturing the NUMERIC DATA ROW instead of the actual label text -- the picker took the first non-blank/non-Indicator/Unit/Source line, which on this corpus's layout is often the bare data row printed right under the header, with the real descriptive label appearing later near the Source line.", "change": "extract.py: row_label picker now also skips lines whose non-space characters are >30% digits.", "decision": "KEPT", "notes": "Clean, well-isolated win: dev recall120 0.1765->0.2941 (hit24 unchanged 2/17), holdout hit24 2->3/30, recall120 0.1667->0.2. Verified in isolation (family walk OFF) that this fix alone produces the full gain -- family walk (tested combined) added exactly nothing on top of it.", "dev_hit24_before": 2, "dev_hit24_after": 2, "dev_recall120_before": 0.1765, "dev_recall120_after": 0.2941, "holdout_hit24_before": 2, "holdout_hit24_after": 3, "holdout_recall120_before": 0.1667, "holdout_recall120_after": 0.2}
{"ts": "2026-09-13T14:30:33Z", "idea": "5_trajectory_family_walk", "iteration": 1, "hypothesis": "Seed from a wide candidate pool, extract the literal row_label from any card-type seed, and directly walk cards_fts.row_labels for exact matches of that label -- meant to pull in sibling yearly editions of the same table that a generic OR query ranks too low to reach.", "change": "retrieve.py: _family_walk() + _merge_family_leads(), gated by USE_FAMILY_WALK (tested True).", "decision": "REVERTED", "notes": "Measured combined with the row_label fix above: IDENTICAL numbers to the row_label fix alone (dev 2/17 0.2941, holdout 3/30 0.2) -- the family walk never contributed a single additional hit. Traced directly on tr_04: even seeding from a 100-wide pool, none of the top-10 seed candidates carried a row_label belonging to the actual Sindh ADP family (the seeds are for OTHER generically-matching tables entirely, not near-misses of the right one), so there was no correct family to walk from. The underlying idea may still be right, but this seeding strategy cannot find a starting point when the base query does not already have partial traction. Left in code, disabled by default.", "dev_hit24_before": 2, "dev_hit24_after": 2, "dev_recall120_before": 0.2941, "dev_recall120_after": 0.2941, "holdout_hit24_before": 3, "holdout_hit24_after": 3, "holdout_recall120_before": 0.2, "holdout_recall120_after": 0.2}
{"ts": "2026-09-13T14:54:02Z", "idea": "3_alias_bridge_widening", "iteration": 1, "hypothesis": "Mined the corpus (not the key) for observed caption variants of the same concept: confirmed a 3rd \"Non-Tax Revenue\" phrasing (\"Other receipts (non-tax)\") already bridges for free via the shared \"non-tax\" token (explains why pl_01 already worked -- OR-matching does not care about word order, so most caption-vs-question rewording is already covered without any alias). The one GENUINE gap found: mb_04/05/07 ask for \"federal development allocation\", which shares no token with the actual table captions (\"Federal PSDP\", \"Public Sector Development Programme (Federal)\"). Added that bridge to the existing PSDP alias group. Deliberately did NOT add releases/allocations as synonyms for development expenditure after re-reading BUILD_PROMPT.md -- it explicitly lists releases/allocations as separate concepts from each other, so bridging them for DISCOVERY would still be a step toward treating them as equivalent, which is the compiler's call, not this layer's.", "change": "aliases.json: PSDP group += [\"federal development allocation\", \"federal psdp\"].", "decision": "REVERTED", "notes": "Zero change on every metric (dev 2/17 0.2941, holdout 3/30 0.2, identical). Confirmed directly on mb_04: even with the new PSDP bridge, the gold Federal PSDP table still does not reach top-24 -- the blocker is the same one found under idea 5 (hundreds of near-identical yearly PSDP/ADP tables competing under generic OR terms), not a vocabulary gap. Reverting the alias addition since it earns its complexity cost nothing; this is the clearest confirmation across the whole session that vocabulary bridging is not the remaining lever for multi_branch/trajectory questions -- volume of near-duplicate candidates is.", "dev_hit24_before": 2, "dev_hit24_after": 2, "dev_recall120_before": 0.2941, "dev_recall120_after": 0.2941, "holdout_hit24_before": 3, "holdout_hit24_after": 3, "holdout_recall120_before": 0.2, "holdout_recall120_after": 0.2}
